{
  "$schema": "../schemas/index.schema.json",
  "version": "1.0.0",
  "generatedAt": "2026-09-22T09:01:28Z",
  "pluginCount": 26,
  "plugins": [
    {
      "name": "anvil-pulse",
      "version": "1.1.0",
      "description": "Live operator dashboard for long autonomous anvil runs: claims, phases, lease countdowns, event feed, and stuck-state detection served as a local web page, plus an optional Claude Code statusline segment.",
      "author": {
        "name": "Sekou Doumbouya",
        "url": "https://github.com/fakoli"
      },
      "repository": "https://github.com/fakoli/fakoli-plugins",
      "license": "MIT",
      "keywords": [
        "claude-code",
        "plugin",
        "anvil",
        "dashboard",
        "heartbeat",
        "monitoring",
        "autonomous-agents"
      ],
      "path": "plugins/anvil-pulse",
      "category": "workflow",
      "indexedAt": "2026-09-05T12:46:12Z"
    },
    {
      "name": "cli-to-plugin",
      "version": "1.1.0",
      "description": "Generate Codex and Claude plugins from captured CLI help with deterministic discovery and scaffolding.",
      "author": {
        "name": "Sekou Doumbouya",
        "url": "https://github.com/fakoli"
      },
      "repository": "https://github.com/fakoli/fakoli-plugins",
      "license": "MIT",
      "keywords": [
        "cli-to-plugin",
        "generator",
        "cli",
        "scaffold",
        "automation"
      ],
      "path": "plugins/cli-to-plugin",
      "category": "development",
      "indexedAt": "2026-09-05T12:46:12Z"
    },
    {
      "name": "excalidraw-diagram",
      "version": "1.1.0",
      "description": "Generate and edit Excalidraw diagrams from natural-language prompts and code context.",
      "author": {
        "name": "Sekou Doumbouya",
        "url": "https://github.com/fakoli"
      },
      "repository": "https://github.com/fakoli/fakoli-plugins",
      "license": "MIT",
      "keywords": [
        "excalidraw",
        "diagram",
        "architecture",
        "flowchart",
        "visualization",
        "whiteboard"
      ],
      "path": "plugins/excalidraw-diagram",
      "category": "media",
      "indexedAt": "2026-09-05T12:46:12Z"
    },
    {
      "name": "fakoli-crew",
      "version": "2.10.0",
      "description": "Coordinate specialist software-engineering agents with TDD, debugging, and verification practices.",
      "author": {
        "name": "Sekou Doumbouya",
        "url": "https://github.com/fakoli"
      },
      "repository": "https://github.com/fakoli/fakoli-plugins",
      "license": "MIT",
      "keywords": [
        "agents",
        "team",
        "crew",
        "orchestration",
        "code-review",
        "typescript",
        "architecture",
        "workflow"
      ],
      "path": "plugins/fakoli-crew",
      "category": "development",
      "indexedAt": "2026-09-05T12:46:12Z"
    },
    {
      "name": "fakoli-flow",
      "version": "1.4.0",
      "description": "Orchestrate brainstorm, planning, and execution workflows through coordinated agents and critic gates.",
      "author": {
        "name": "Sekou Doumbouya",
        "url": "https://github.com/fakoli"
      },
      "repository": "https://github.com/fakoli/fakoli-plugins",
      "license": "MIT",
      "keywords": [
        "workflow",
        "orchestration",
        "planning",
        "brainstorming",
        "intent-driven",
        "agents",
        "wave-engine",
        "code-review"
      ],
      "path": "plugins/fakoli-flow",
      "category": "workflow",
      "indexedAt": "2026-09-05T12:46:12Z"
    },
    {
      "name": "fakoli-plugin-critic",
      "version": "0.2.0",
      "description": "Review plugin agents, skills, hooks, MCP servers and packaging against the target host conventions.",
      "author": {
        "name": "Sekou Doumbouya",
        "url": "https://github.com/fakoli"
      },
      "repository": "https://github.com/fakoli/fakoli-plugins",
      "license": "MIT",
      "keywords": [
        "plugin-development",
        "code-review",
        "agents",
        "critics",
        "mcp",
        "hooks",
        "skills",
        "audit",
        "claude-code"
      ],
      "path": "plugins/fakoli-plugin-critic",
      "category": "development",
      "indexedAt": "2026-09-05T12:46:12Z"
    },
    {
      "name": "fakoli-speak",
      "version": "2.1.0",
      "description": "Speak text through multiple providers with owned playback cleanup and cost estimates.",
      "author": {
        "name": "Sekou Doumbouya",
        "url": "https://github.com/fakoli"
      },
      "repository": "https://github.com/fakoli/fakoli-plugins",
      "license": "MIT",
      "keywords": [
        "tts",
        "text-to-speech",
        "elevenlabs",
        "openai",
        "deepgram",
        "google",
        "macos",
        "accessibility",
        "audio",
        "streaming",
        "multi-provider"
      ],
      "path": "plugins/fakoli-speak",
      "category": "media",
      "indexedAt": "2026-09-05T12:46:12Z"
    },
    {
      "name": "fakoli-state",
      "version": "1.24.0",
      "description": "Turn PRDs into lockable, evidence-backed work packets for humans and coding agents.",
      "author": {
        "name": "Sekou Doumbouya",
        "url": "https://github.com/fakoli"
      },
      "repository": "https://github.com/fakoli/fakoli-plugins",
      "license": "MIT",
      "keywords": [
        "agent-coordination",
        "claims",
        "evidence-based",
        "llm-work-packets",
        "local-first",
        "mcp",
        "project-state",
        "runtime-neutral",
        "sqlite",
        "terraform-for-work"
      ],
      "path": "plugins/fakoli-state",
      "category": "workflow",
      "indexedAt": "2026-09-05T12:46:12Z"
    },
    {
      "name": "fakoli-style",
      "version": "1.3.0",
      "description": "Track Fakoli operating-model principles in a governed ledger with generated reports.",
      "author": {
        "name": "Sekou Doumbouya",
        "url": "https://github.com/fakoli"
      },
      "repository": "https://github.com/fakoli/fakoli-plugins",
      "license": "MIT",
      "keywords": [
        "principles",
        "ledger",
        "governance",
        "operating-model",
        "documentation"
      ],
      "path": "plugins/fakoli-style",
      "category": "utilities",
      "indexedAt": "2026-09-05T12:46:12Z"
    },
    {
      "name": "fleet-exec",
      "version": "1.0.1",
      "description": "Structured remote execution over SSH — run commands, fetch/push files, and read host facts across a fleet without hand-quoted ssh one-liners",
      "author": {
        "name": "Sekou Doumbouya",
        "url": "https://github.com/fakoli"
      },
      "repository": "https://github.com/fakoli/fakoli-plugins",
      "license": "MIT",
      "keywords": [
        "ssh",
        "remote-execution",
        "fleet",
        "mcp",
        "ops"
      ],
      "path": "plugins/fleet-exec",
      "category": "development",
      "indexedAt": "2026-09-05T12:46:12Z"
    },
    {
      "name": "gate-router",
      "version": "1.1.0",
      "description": "Deterministic changed-path gate routing: map changed files to the verify commands this repo requires before shipping, from a per-project rules file instead of session memory.",
      "author": {
        "name": "Sekou Doumbouya",
        "url": "https://github.com/fakoli"
      },
      "repository": "https://github.com/fakoli/fakoli-plugins",
      "license": "MIT",
      "keywords": [
        "verification",
        "gates",
        "changed-files",
        "pre-commit",
        "workflow"
      ],
      "path": "plugins/gate-router",
      "category": "development",
      "indexedAt": "2026-09-05T12:46:12Z"
    },
    {
      "name": "gws",
      "version": "0.4.2",
      "description": "Operate Google Workspace services through skills, commands, agents, and automation recipes.",
      "author": {
        "name": "Sekou Doumbouya",
        "url": "https://github.com/fakoli"
      },
      "repository": "https://github.com/fakoli/fakoli-plugins",
      "license": "MIT",
      "keywords": [
        "google-workspace",
        "gmail",
        "calendar",
        "drive",
        "sheets",
        "docs",
        "slides",
        "tasks",
        "chat",
        "meet",
        "forms",
        "classroom",
        "keep",
        "people",
        "events",
        "admin-reports",
        "modelarmor",
        "productivity",
        "gws",
        "persona",
        "executive-assistant",
        "project-manager",
        "hr-coordinator",
        "sales-ops",
        "it-admin",
        "content-creator",
        "customer-support",
        "event-coordinator",
        "team-lead",
        "researcher",
        "recipe",
        "workflow",
        "automation"
      ],
      "path": "plugins/gws",
      "category": "integrations",
      "indexedAt": "2026-09-05T12:46:12Z"
    },
    {
      "name": "handoff",
      "version": "0.3.1",
      "description": "Store durable cross-session project handoff notes shared across same-remote checkouts.",
      "author": {
        "name": "Sekou Doumbouya",
        "url": "https://github.com/fakoli"
      },
      "repository": "https://github.com/fakoli/fakoli-plugins",
      "license": "MIT",
      "keywords": [
        "memory",
        "handoff",
        "session",
        "worktree",
        "context",
        "resume"
      ],
      "homepage": "https://github.com/fakoli/fakoli-plugins/tree/main/plugins/handoff",
      "path": "plugins/handoff",
      "category": "productivity",
      "indexedAt": "2026-09-22T09:01:28Z"
    },
    {
      "name": "marketplace-manager",
      "version": "2.0.1",
      "description": "Manage marketplace plugins, validate manifests, and regenerate registry indices.",
      "author": {
        "name": "Sekou Doumbouya",
        "url": "https://github.com/fakoli"
      },